reviewId,userName,userImage,content,score,thumbsUpCount,reviewCreatedVersion,at,replyContent,repliedAt,appVersion
1bc017ec-69fc-487b-9395-c5fe587c8a9d,neale helsel,https://play-lh.googleusercontent.com/a/ACg8ocK3uKdI1or9lq0P7xkgiE3_A8eAM6sUh2iFiO5gDodT=mo,Worse dating app I've used. You have to pay for everything. If you do Match with someone they have 24 hours to message you or it goes away.. unless you pay money to give them more time of course ... biggest scam site I've seen,1,0,5.359.1,2024-03-12 23:57:11,"All of our core features are free to use. You don't have to pay to swipe, make matches, or send messages. We offer a few paid options to access additional features, but they're totally optional. You don't have to pay to make authentic connections in the Hive. If you have any questions, definitely reach out to our Support Team at bumble.com/contact",2024-03-15 09:33:55,5.359.1
5d3d01c3-5c71-4828-b4dd-aa5ba5324688,Relva,https://play-lh.googleusercontent.com/a-/ALV-UjUygYtOwZHUElnmPOoRfqLCYJ0cCUf1QcKerF1IbSiAQxQ,"This app is becoming more scummy. They literally put the girl that swiped right to you, right at the end of your daily swipes so that dudes will never get matched now. Absolutely horrible.",1,0,5.359.1,2024-03-12 23:49:41,We're sorry to hear you haven't had the best experience on Bumble. For ideas to improve your profile check out these resources (1) bumble.com/the-buzz/best-bumble-profile-photo-tips and (2) bumble.com/help/i-m-not-getting-any-matches.,2024-03-15 09:33:53,5.359.1
a13fd342-e13e-4030-9706-9337e324f363,Sara C,https://play-lh.googleusercontent.com/a/ACg8ocJfu8EVdcX14KHJ3ZBgT74ypWR0ws2FVLLIIup2Z-sS=mo,Pointless. The distance filters don't work. Mine were set to 30 miles and the people shown were 50-500 miles away. Some were even in France. Hardly anybody replied and in 3 weeks I didn't get a single conversation or meet-up. This app is much worse than Tinder for this reason and because you can only swipe right a few times a day. It's pointless swiping at all though because nobody replies to messages - or if they do it's just a wave or a 'hi'. Most of the men aged over 40 are pretty horrific.,1,0,,2024-03-12 22:50:39,"Your Beeline will show all members who've swiped right on your profile (even if they no longer fit your distance preferences). But, the members closest to you will appear at the top of your Beeline, so you see them first. Sorry to hear you're having trouble connecting with your matches. Try sending a personalized, creative message. You got this! 💛",2024-03-15 22:16:53,
e303ec0b-a710-4b9d-b7ee-7fa37a9f21a2,Jack Ruby,https://play-lh.googleusercontent.com/a-/ALV-UjXS-iUX9GwpuEb8WZSk-vYFARS8gFE7ibxcHzIe2K2aXBQ,Why EVEN BOTHER WITH AMERICAN MODERN WOMEN ??? WHY FELLAS ...YOUR ONLY USED FOR FREE MEALS AN DAYCARE ...STOP THIS...AN GET PASSPORTS FAST,1,0,5.361.0,2024-03-12 22:44:29,,,5.361.0
68b5bc33-b348-41ba-815b-fc77b0480431,Kaloqn Todorov,https://play-lh.googleusercontent.com/a-/ALV-UjUw0nQpGOSG2lwHjlgMX5q3XvBYM4fOqcTBfwbVK6QoHg,"Very positive interactions with most people on this app, differently from other ones",5,0,5.359.1,2024-03-12 21:47:06,We’re so happy to hear you are buzzin’ about the people you are meeting! It makes all the difference when you connect with like-minded people each and every day! ✨,2024-03-13 07:54:22,5.359.1
c868cccb-2d0e-4b9f-b0e4-a9ee178252d8,Call Me Wisal,https://play-lh.googleusercontent.com/a-/ALV-UjXEfkzyo4YtUOCVsNtB3NPvjyc3Z7W1BD6pi8QzWvqPU4E,Good app,4,0,5.327.0,2024-03-12 21:40:39,We're so happy to hear that! We love that you enjoy buzzin' in the Hive. 🐝,2024-03-13 07:53:26,5.327.0
12fcc71e-914e-4e2b-93f7-e0c44c1f9301,William Porter,https://play-lh.googleusercontent.com/a/ACg8ocIxuJqBZ5o64_BfFKAn-JdgDVdjSIxJsvEg4J79qk37=mo,6uuii ⁸et,4,0,5.361.0,2024-03-12 21:29:26,"Merci de nous avoir fait part de votre avis. Nous sommes ravis de voir que vous appréciez l'utilisation de l'application! Si vous avez des suggestions ou des améliorations, n'hésitez pas à nous contacter à @bumblesupport sur Twitter ou à bumble.com/contact. 💌",2024-03-16 07:47:56,5.361.0
8c5cd1ba-335d-4a83-b29c-9c057599bb28,William Dennis,https://play-lh.googleusercontent.com/a-/ALV-UjU9FT4U59bw3MyeS86b1Qt1_YtgSwUUTcyOShQARzS-WuQ,worst datingapp,1,0,,2024-03-12 21:17:53,We're sorry you didn't enjoy your experience on Bumble. Our team would love the opportunity to improve your experience in the Hive! Please message our Support Team on Twitter or Facebook (@BumbleSupport) and we'd be happy to help.,2024-03-13 07:53:24,
1080cca3-6dde-4cb4-99bd-8cfbf66ebe8d,Calvin Moore,https://play-lh.googleusercontent.com/a-/ALV-UjX2b61FJrHxSrAuaQa_dPTvruftQmKM5u-RMYKJuY_EAA,Great 😃,5,0,5.359.1,2024-03-12 21:16:45,It's great to hear that you're buzzin' in the Hive! 🐝,2024-03-13 07:53:23,5.359.1
67374c48-3f07-461a-9ff4-e196e07a08ac,Condrat Alexandru,https://play-lh.googleusercontent.com/a-/ALV-UjXL4YpWHJ93OZ0dyIx2xofnhzt-Oiw1lXNVEMefVGlMEu4,Worst dating app from all. Waste of money,1,0,,2024-03-12 21:01:55,We're sorry you didn't enjoy your experience on Bumble. Our team would love the opportunity to improve your experience in the Hive! Please message our Support Team on Twitter or Facebook (@BumbleSupport) and we'd be happy to help.,2024-03-13 10:55:53,
344dec81-c564-45a4-8ebe-6b7bb97848fb,Hermanni Heimonen,https://play-lh.googleusercontent.com/a-/ALV-UjXpi9MfJ-du9euICXbsN1Js1LY1AHCgk413Fb84QEMg4WQ,"Scammy paid subscription. The subscription keeps renewing every day, and it's near impossible to cancel. There is no clear button to cancel and ""deleting my payment info"" has no effect. The link below that they claim has instructions for cancelling is missing how you have to click on an area of the screen that does not look like a button, and then click on a translucent text in an extremely small size below the pop-up that says ""cancel subscription"". The ""instructions"" make it even scammier.",1,8,5.359.1,2024-03-12 20:59:56,"Hey Hermanni! We appreciate you sharing your feedback with us. We are always looking for ways to improve our members' experience on the app so we will make sure to pass your input along to our Product Team. If you're still having issues canceling your subscription, please reach out to bumble.com/contact. We're happy to help!",2024-03-14 22:44:22,5.359.1
6e3626db-704a-47b0-87eb-5d9e150e92f0,Afghan Afghan,https://play-lh.googleusercontent.com/a/ACg8ocK3fdrS-xd8PwqlQckfHP1Z0lk9vtouPBIa09PHoels=mo,Its a good app but expensive the prices should be low just like compliments and likes and one thing other that might be fix that here in pakistan alots of people using easypaisa so this should be two choises payment method one through bank other easy paisa think about this its a huge bussines not need money for this mindset because i have mercy😂,3,0,5.359.1,2024-03-12 20:40:46,Hey Afghan! We appreciate you sharing your feedback with us. We are always looking for ways to improve our members' experience on the app so we will make sure to pass your input along to our Product Team.,2024-03-14 22:42:23,5.359.1
eb6058de-3be1-4744-9ed6-8bfc6e444184,Alicia Mccurley,https://play-lh.googleusercontent.com/a-/ALV-UjUfrAoSjvt_Mel-E94AT-_AicxzbHO0jn5g2qHqnfcXGDY,Terrible! Don't waste your money! I couldn't verify my photo bc of a sunburn?! Come on!,1,0,5.359.1,2024-03-12 20:34:32,Oh no! Our Support Team would be more than happy to help assist you with verifying your profile. Send us a quick message at bumble.com/contact or on Facebook or Twitter (@BumbleSupport) and we'll get you up and buzzin' in no time!,2024-03-14 09:50:53,5.359.1
ebd2ce60-2751-4bee-a05c-ca4b61704ab3,Francesco Tableau,https://play-lh.googleusercontent.com/a/ACg8ocKSrM0IcCNB6FaFr8RzTzAZ8KGfNeO0C1I5_z98Q4rg=mo,"Very few matches, mostly fake profiles. Just losing my money by using this app",1,0,5.359.1,2024-03-12 20:22:46,"We're so sorry about your experience with us. We absolutely do not tolerate fake profiles on Bumble and would like to look into this. Please message our Support Team on Twitter or Facebook (@BumbleSupport), so our team can look into this.",2024-03-14 09:51:22,5.359.1
d9f739c2-9be2-41d6-b3a6-0d699b89b563,Steven Sherman,https://play-lh.googleusercontent.com/a/ACg8ocKx85t5SS2RFnFPeuh3hlm9MvHThFMLwvtH9RkZX5pS=mo,"A bit expensive... Yes, it's initially free. To send any compliments or messages it's more than $1 per note, and a Superlike is also over $1. Maybe a few free per week?",4,0,5.359.1,2024-03-12 20:19:12,Hi Steven! We appreciate you sharing your feedback with us. We are always looking for ways to improve our members' experience on the app so we will make sure to pass your input along to our Product Team.,2024-03-14 22:41:22,5.359.1
3a5ddcaf-a4d7-4028-b7f8-e614eece67f2,Agastya More,https://play-lh.googleusercontent.com/a/ACg8ocKP5QubcT1Eybter5pbv5XHlce-sJOIEZhQOWr3uNX-=mo,goog,5,0,5.359.1,2024-03-12 19:59:14,We appreciate your kind words. 🙌,2024-03-13 07:43:52,5.359.1
d540b51d-09a0-4de6-bf86-55581e8d2327,Natwijuka Marion,https://play-lh.googleusercontent.com/a/ACg8ocJIE_PXISNtdIeFjQIe0PzUxwu3y0o36xXhvjBrRffS=mo,I hope I get the best match here the app looks genuine,1,0,5.359.1,2024-03-12 19:33:39,We're so happy to hear that! We love that you enjoy buzzin' in the Hive. 🐝,2024-03-14 09:50:54,5.359.1
0996f4d4-d758-4791-b5fd-04829877cd9d,D Tell,https://play-lh.googleusercontent.com/a/ACg8ocLUiGIDxjE0cVYdmtR7_Y5gEQhcnis8BwgDsuNsk5Rj=mo,Horrible app. They except you to pay just to be able to like more then 30 people at most in 24 hours. The likes you send only reset after 24 hours. Not at 12am the next day. And if you're lucky and get 1 match it expires in 24 hours unless you spend money to extend it or the girl messages first which never happens. Don't waste your time and especially your money on this app,1,3,5.361.0,2024-03-12 19:31:31,"All of our core features are free to use. You don't have to pay to swipe, make matches, or send messages. We offer a few paid options to access additional features, but they're totally optional. You don't have to pay to make authentic connections in the Hive. If you have any questions, definitely reach out to our Support Team at bumble.com/contact",2024-03-14 22:40:53,5.361.0
b7b93775-9319-44af-af3e-4f65a31760ce,Kyle G Horst,https://play-lh.googleusercontent.com/a/ACg8ocI5cIxmoAeJiFcRgX657fm4EU0Ktq5phJQVJnl2KdF9=mo,not the best experience for men. should be free for men.,2,0,5.359.1,2024-03-12 19:27:01,"All of our core features are free to use. You don't have to pay to swipe, make matches, or send messages. We offer a few paid options to access additional features, but they're totally optional. You don't have to pay to make authentic connections in the Hive. If you have any questions, definitely reach out to our Support Team at bumble.com/contact",2024-03-13 07:43:23,5.359.1
ff5b7032-b3f8-40f8-a278-75d6d952dd24,Andrew,https://play-lh.googleusercontent.com/a-/ALV-UjXDePbPVHyz6MOW0suoLuFpuJUhcvM54bTKcuwRCqqWB4k,Another worthless dating app. Just like others have said the location filter doesn't work and they create new ways to get more $ without offer much in improvements.,1,0,,2024-03-12 19:23:42,"Hi Andrew! We're happy to look into this for you. Can you please message us on @BumbleSupport on social media with a few more details? Or, you can contact us via bumble.com/contact 💛",2024-03-14 22:40:23,
1fc2a08b-6647-409a-9612-30e4a616b6c1,Richard Stokes,https://play-lh.googleusercontent.com/a-/ALV-UjWzbSwO1zDDyY20fDd84SF1O2UhR5V5bPkFX_19MBf5Pw,good app,5,0,5.359.1,2024-03-12 18:35:57,Thanks for your kind words. Your feedback is so valuable to our team—we love knowing that you’re enjoying your experience. 💛,2024-03-13 07:42:52,5.359.1
1339a5c3-670a-45ad-9338-21f56eb7ea7c,Plmnjio Qazzsw,https://play-lh.googleusercontent.com/a-/ALV-UjWyJlRRep-e33BKvq3JBoPOs9ym77wByZE3tSMAVhGrJO8d,This is a man hating feminist app . This app has to be banned .,1,0,,2024-03-12 18:19:09,Hi there! We're sorry you didn't enjoy your experience on Bumble. Our team would love the opportunity to improve your experience in the Hive! Please message our Support Team on Twitter or Facebook (@BumbleSupport) and we'd be happy to help.,2024-03-14 22:33:24,
b83ac208-16be-4f3a-bf5d-6a9bf4759e7d,John Vaughañ,https://play-lh.googleusercontent.com/a/ACg8ocIr-MBDLP4oaIG6HaZ2ivdnC-4cKwxYu2UfSp89y06u=mo,Love. ..lov. Bumble,4,0,5.359.1,2024-03-12 18:06:26,Thanks for your kind words. Your feedback is so valuable to our team—we love knowing that you’re enjoying your experience. 💛,2024-03-13 07:35:28,5.359.1
e0adb903-1d38-475a-a324-08f0b1ea6934,surreal feel,https://play-lh.googleusercontent.com/a/ACg8ocLQ0ZQmVZWckkKBXWpMv0hgeqgN2RN2LCHOuyYzPmlM=mo,Makes it impossible to cancel subscription and will charge you a bunch of money,1,0,5.359.1,2024-03-12 17:42:30,"The steps to cancel your subscription will depend on your payment method. You can find instructions on our Help Center here: https://bumble.com/en/help/how-can-i-cancel-my-bumble-boost--bumble-premium-subscription. If you're unable to cancel your subscription following those steps, please reach out to bumble.com/contact.",2024-03-13 07:35:22,5.359.1
5e0accba-903b-43d3-8bf1-3a0c5c2a922b,mel roland,https://play-lh.googleusercontent.com/a/ACg8ocKpH2dByHUW9fJCwmUKN7LHGiDa502sefUHjMYUCvS4=mo,so far so good,3,0,5.361.0,2024-03-12 17:31:34,We appreciate your kind words. 🙌,2024-03-13 07:34:54,5.361.0
44c702dd-0adf-4c3b-87c8-90d7ee611e34,Yaesine Yaya,https://play-lh.googleusercontent.com/a/ACg8ocKWDGxyNNMsBn4qOXNLZ0RxhckXIr2U40hNmMPU-L9p=mo,"BelterLivin transforms the Bumble dating experience with its dynamic live simulator features. Integrating BelterLivin adds an exciting twist to Bumble, offering personalized soundtracks and seamless sharing. For users seeking an immersive and engaging dating journey, pairing Bumble with BelterLivin is the perfect choice. Explore a new realm of connections with BelterLivin on Bumble",3,0,5.359.1,2024-03-12 17:06:15,,,5.359.1
32b15299-b677-4230-bb52-2c858465ba40,shashank shandilya,https://play-lh.googleusercontent.com/a-/ALV-UjWC0exKvC5HUHbjHrKL8u-Yc_COvK8XZp1JO0TXzdIOsg,Almost paid whatever they asked for...but no response. You guys just making money and playing with others emotion.,1,0,5.359.1,2024-03-12 16:48:01,"Hey Shashank! We're sorry to hear about this. Our team would love the opportunity to improve your experience in the Hive! Please message our Support Team on Twitter or Facebook (@BumbleSupport), and we'd be happy to help.",2024-03-14 22:33:23,5.359.1
0819fc68-69db-4f28-9488-cbba05b5924d,James Bond,https://play-lh.googleusercontent.com/a/ACg8ocI_Hh6j32XEd8fjsKZfTYVa3Rj5T_e_glWTwlE-iN5M=mo,"Instantly ask me to change filters selections after a few interest, single guy looking for women, empty screen stayed that way for months, uninstall..",1,0,,2024-03-12 15:40:39,"Hi James! It looks like you've run out of members to swipe on right now. Don't worry though, there are always new bees joining the Hive daily! We recommend checking back in after 24 hours and if you can try expanding your preferences and removing any Advanced Filters to introduce new bees into your swipe queue! 💛",2024-03-14 22:32:23,
16846c44-5a72-4095-8d85-ebb23a786fdc,Darren Kelly,https://play-lh.googleusercontent.com/a/ACg8ocLLcdj84LKAAlz-Y3FeroQCWw2CmSY-x5NkfEdf_UKV=mo,Cyrus 5th year is ⁶and has been busy ⁶the,3,0,5.359.1,2024-03-12 15:39:18,"Hi Darren! Thanks for the review. If you have any suggestions or improvements, feel free to contact us at @bumblesupport on Twitter or bumble.com/contact. 💌",2024-03-14 22:38:52,5.359.1
7dffa07d-55c2-4799-b57a-37debacdaa43,Julie Olivia,https://play-lh.googleusercontent.com/a/ACg8ocLbBMYI5QfZsyTJ6pfKqwLkA6qrGid5lvi9QDRnog6g=mo,Find soulmate,1,0,5.359.1,2024-03-12 15:28:55,"We're sorry to hear about this. Please message our Support Team on Twitter or Facebook (@BumbleSupport), so our team can take a look.",2024-03-13 00:20:24,5.359.1
7a7cf659-836e-48e8-a022-d8e841d9b69e,karnati sampath,https://play-lh.googleusercontent.com/a/ACg8ocKp04nkOHJZubl2whgEA_0cgHbGJBPa9Bh20EXEfkk=mo,Worst app I have never seen most of them are fake profiles always asking to upgrade for premium when I paid to premium. They will show no results for half day at the time of expiry they will show few profiles and again they will ask to upgrade for premium,1,1,5.359.1,2024-03-12 15:28:53,"We take fake profiles seriously on our platform and have a team dedicated to investigating suspicious accounts. If you’re ever unsure about a profile, please report them in the app and we'll investigate right away!",2024-03-13 00:19:54,5.359.1
e8950739-240c-4d14-b065-151ec9e880b5,preston broderick,https://play-lh.googleusercontent.com/a/ACg8ocJgEg0hJ9CiRPdqCjV-OTeu-nU8XRPiIEc-uhJ9uYWF=mo,"It counts your swipe left as a swipe right, not giving you the person but taking away one of your limited amount of swipe rights. You have to pay or you won't get any matches.",1,0,5.361.0,2024-03-12 14:59:49,"Thank you for your feedback. We're always working to increase the number of genuine, quality connections for our members. We've incorporated a swipe limit to encourage more intentional swiping and increase the chances of making great connections. You're always welcome to upgrade your account to Premium if you'd like to have unlimited swipes.",2024-03-13 00:19:23,5.361.0
a70cb176-cc1e-4a77-9e22-e5ba5b272a30,E NS,https://play-lh.googleusercontent.com/a-/ALV-UjWYCivg2xIe7tRvK2LUU1_qA78x622Et1qHJOyK9e2l7L9_,"This app is trash for women over 40. First, no option to weed out travelers (even as a subscriber) and there are a LOT. Most men I'm matched with aren't even capable of taking a good photo. And when they do they look like psycho killers. The ""spotlight"" feature and ""Beeline"" don't help get better matches. Never met anyone in person and think I chatted with 1 person in 3 months.",2,0,5.359.1,2024-03-12 14:42:45,We're sorry to hear you haven't had the best experience on Bumble. For ideas to improve your profile check out these resources (1) bumble.com/the-buzz/best-bumble-profile-photo-tips and (2) bumble.com/help/i-m-not-getting-any-matches.,2024-03-13 00:18:24,5.359.1
f2813228-d3af-483e-ae30-33c49d671bd9,Pedro ?,https://play-lh.googleusercontent.com/a/ACg8ocKUvX9sh_fompW3Iu4tlrbwU6X2Dm5ZeaKq7ky_09kbrg=mo,what a cash grab app for guys ... it's so dumb to charge so much for so little.. worthless app honestly.,1,0,,2024-03-12 14:41:56,"All of our core features are free to use. You don't have to pay to swipe, make matches, or send messages. We offer a few paid options to access additional features, but they're totally optional. You don't have to pay to make authentic connections in the Hive. If you have any questions, definitely reach out to our Support Team at bumble.com/contact",2024-03-12 16:11:54,
68146431-624a-4b85-9cdb-22235e3ee920,Ana Rozy,https://play-lh.googleusercontent.com/a/ACg8ocLcgB4ADwbXNGT1wZwPF1qQpXGFQja6y20hSzPSWLoE=mo,"Just a waste of time downloading this app, it charges you even for liking e.g swiping right.",1,0,,2024-03-12 14:29:18,"All of our core features are free to use. You don't have to pay to swipe, make matches, or send messages. We offer a few paid options to access additional features, but they're totally optional. You don't have to pay to make authentic connections in the Hive. If you have any questions, definitely reach out to our Support Team at bumble.com/contact",2024-03-12 16:11:53,
3ce1ed5b-1793-4db8-9fbe-b6d44df89a8f,Aisha Yolam,https://play-lh.googleusercontent.com/a/ACg8ocJXnFUtFvaJAw80WDcFtHjCU4V_FYKM9AAPOr1ZSWi4=mo,Love Sweet,5,0,5.359.1,2024-03-12 13:57:29,We appreciate your kind words. 🙌,2024-03-12 16:11:23,5.359.1
5c746e75-c1b3-4bd8-9a2b-7024ef1a365e,Raufiur Rahim Rupon,https://play-lh.googleusercontent.com/a-/ALV-UjUGqijJ1-OR--_o5s0O7Ign7KlqfNMLYFxXh7cbR3MHmqE,good,5,0,5.359.1,2024-03-12 13:31:41,We appreciate your kind words. 🙌,2024-03-12 15:14:24,5.359.1
58cda94a-610e-41af-aee9-438d3939c06c,Jace Van Riper,https://play-lh.googleusercontent.com/a-/ALV-UjXeBU8frxpt9rcM7bpZpR7Zgl6heVJnJvnpiVJ1fgLKG1g,"I haven't used Bumble since December 2023. Deleted my account. As of today, i am still being charged $53.49/month. Went on my ""subscriptions"" tab on the Play store and I don't even have a subscription anymore. How am I being charged money for an account that is deleted and the subscription was also deleted. I want a refund for the past 3 months. I can provide documents and statements. This is ridiculous. Borderline invasive.",1,0,,2024-03-12 12:56:51,We’re so sorry to hear this happened and would like our Billing team to have a look. Please send us a message at http://bumble.com/contact or on Facebook or Twitter (@BumbleSupport). We look forward to hearing from you!,2024-03-13 00:16:53,
245a3e29-1927-4f3d-9fc7-7f4f4c550409,Joshua van Veen,https://play-lh.googleusercontent.com/a-/ALV-UjVhgNkaWQYclgi1DXY0x0yzOugqeSgd5ISwmIaW5oowB1I,it is useful for making friends and building your network. you have time limits on messages.,4,0,5.356.1,2024-03-12 11:47:53,We're so happy to hear that! We love that you enjoy buzzin' in the Hive. 🐝,2024-03-12 12:41:54,5.356.1
7cec5a8d-a0e3-4661-9b45-e2cd617ee2b3,Alex “Dee” Danger,https://play-lh.googleusercontent.com/a/ACg8ocLQu3uBnFfMWcKhJmyQpV4J9OJdRymyvfceyUz1yid6=mo,"Could not see option to unsubscribe . Only wanted to talk to one girl and I had already told bumble I wanted to unsubscribe, asked how, no response.",1,0,5.359.1,2024-03-12 11:33:31,"The steps to cancel your subscription will depend on your payment method. You can find instructions on our Help Center here: https://bumble.com/en/help/how-can-i-cancel-my-bumble-boost--bumble-premium-subscription. If you're unable to cancel your subscription following those steps, please reach out to bumble.com/contact.",2024-03-12 12:41:53,5.359.1
84104104-dce6-4fed-9c12-dc16af1f30e5,Howard Dell Smith,https://play-lh.googleusercontent.com/a-/ALV-UjX-MY3O95GSWEPKVEWosDnsmuFmICIC_XLqB1YV7e9JbeE,"Hi Bumble, it's time to change your match requirements, if men and women match let them both have the chance to say hello. You're not being fair to the men, people are busy some may come on the app once or twice a week. I had recently 4 matches two of these ladies came from my little island of Jamaica and I was excited to connect with a fellow Jamaican. After 24 hrs they disappeared. I can understand people have busy lives. Disappointed. Back to the drawing board for your next office meeting.",3,0,5.359.1,2024-03-12 09:39:17,"Thanks for your feedback, we'll be sure to pass this along to our Product Team to consider in the future. If you didn't already know, we provide each user with one free Extend per day, and with a Boost or Premium subscription users can Extend an unlimited number of matches and even Rematch with expired connections.",2024-03-12 10:53:53,5.359.1
716057a4-4800-42e7-9f84-b649c4fa1556,xandrer,https://play-lh.googleusercontent.com/a-/ALV-UjVLEUN6u7uew6DuI3dyJdlwpiUe97fMb740vNKDqukJPU4,"The app works fine, is the people (girls in this case) that don't understand how it works. They still ask in their profile to be contacted first after a match... One thing that could be improved in the app is that when you get a like it should be shown straight as the first ""card"" when you open the app, as it happens in the other apps and not just by buying the membership.",3,52,5.359.1,2024-03-12 09:29:13,We appreciate you sharing your feedback with us. We are always looking for ways to improve our members' experience on the app so we will make sure to pass your input along to our Product Team.,2024-03-12 10:52:52,5.359.1
dfa31b2e-3431-42b4-a853-2b4c8401fa23,Prayas Ingale,https://play-lh.googleusercontent.com/a-/ALV-UjU4ntAP0PxxG8xgdw5zIkwuR4qNP25_ZXaftXRKgyKZO7o,Very bad experience i bought twice premium but i still didn't got match,1,1,,2024-03-12 09:19:30,"Thanks for reaching out. While our subscriptions are there to help maximize your experience, we can't promise exact results for anyone. If you’d like to talk to a Support Team Member about your profile to check everything is running as it should be, please message us here: bumble.com/contact.",2024-03-12 10:52:22,
9b42fbf8-52b2-4384-a497-90d87df7644e,Khent Bryant Alvezo,https://play-lh.googleusercontent.com/a/ACg8ocJSIOL8NasO4XjjI7lWzvN058hbc2HVZTsBoIF4Efo=mo,Lahat may bayad amp,1,0,5.359.1,2024-03-12 08:59:39,"All of our core features are free to use. You don't have to pay to swipe, make matches, or send messages. We offer a few paid options to access additional features, but they're totally optional. You don't have to pay to make authentic connections in the Hive. If you have any questions, definitely reach out to our Support Team at bumble.com/contact",2024-03-13 00:16:24,5.359.1
acf5443f-a14a-46af-9641-75fc30c2bbcf,Steve Goodwin,https://play-lh.googleusercontent.com/a-/ALV-UjWTlXjtBrpi6zHeX68MK5dk4qVfAM-vT140xd8hW0-30A,"Paid for premium, likes reveal didn't work... It showed 50+ likes, but they just disappeared after I paid. Should be refunded for this, as it was a total mislead sale. Not as advertised.",1,3,5.359.1,2024-03-12 08:39:07,"This definitely doesn't sound right, and we're sorry to read about it. Please message our Support Team on Twitter or Facebook (@BumbleSupport), so our team can take a look.",2024-03-12 10:54:25,5.359.1
38b9f2d0-32a5-4ad3-a825-083aa9655f6c,Victory Paul,https://play-lh.googleusercontent.com/a-/ALV-UjUidiN6b7Yw_hzcNAN_YOZryrpCkdnMsgUJhLOsHOJTWg,"Why d extra debit? I subscribed for 3500 & bumble debited 7000, this isn't the first time it's happening, I need explanations before thunder fire y'all",2,0,5.355.0,2024-03-12 08:27:38,We’re so sorry to hear this happened and would like our Billing team to have a look. Please send us a message at http://bumble.com/contact or on Facebook or Twitter (@BumbleSupport). We look forward to hearing from you!,2024-03-12 10:54:23,5.355.0
